{
  "$schema": "https://json-schema.org/draft/2020-12/schema",
  "$id": "https://uzbekistan-os.local/schemas/extraction-artifact.schema.json",
  "title": "Pre-review extraction artifact",
  "type": "object",
  "required": [
    "schema_version",
    "source_id",
    "snapshot_id",
    "adapter_key",
    "media_type",
    "raw_sha256",
    "normalized_sha256",
    "extracted_at",
    "sections"
  ],
  "properties": {
    "schema_version": { "const": "1.0" },
    "source_id": { "type": "string", "format": "uuid" },
    "snapshot_id": { "type": "string", "format": "uuid" },
    "adapter_key": { "type": "string", "pattern": "^[a-z0-9]+(?:-[a-z0-9]+)*$" },
    "media_type": { "type": "string", "minLength": 1 },
    "raw_sha256": { "type": "string", "pattern": "^[a-f0-9]{64}$" },
    "normalized_sha256": { "type": "string", "pattern": "^[a-f0-9]{64}$" },
    "extracted_at": { "type": "string", "format": "date-time" },
    "sections": {
      "type": "array",
      "minItems": 1,
      "items": {
        "type": "object",
        "required": ["id", "heading", "body"],
        "properties": {
          "id": { "type": "string", "pattern": "^[a-z0-9]+(?:-[a-z0-9]+)*$" },
          "heading": { "type": "string", "minLength": 1 },
          "body": { "type": "string", "minLength": 1 }
        },
        "additionalProperties": false
      }
    }
  },
  "additionalProperties": false
}
